Title,Subtitle,Topic,Tag1,Tag2,Tag3,Tag4,Tag5,URL
Supercharge Your GitHub Repo with GitHub Actions,GitHub Actions Explained: Simplify Your Development Workflow,Data Engineering,DevOps,Git,Github,Github Actions,Data Engineering,https://medium.com/devops-dev/supercharge-your-github-repo-with-github-actions-292a4ba75333
Fine-Tuning T5 for Summarization: A Beginner’s Guide,Fine-Tuning Summarization Models with Hugging Face: From Data to Deployment,LLM,NLP,Generative Ai Tools,Deep Learning,Hugging Face,Fine Tuning,https://medium.com/ai-mind-labs/fine-tuning-t5-for-summarization-a-beginners-guide-1d0fce60f680
EfficientNet Unpacked: From Compound Scaling to Training-Aware NAS,EfficientNet V1 to V2: A Journey Through Smarter Model Design,Deep Learning,Convolutional Network,Computer Vision,Deep Learning,Image Processing,Artificial Intelligence,https://medium.com/stackademic/efficientnet-unpacked-from-compound-scaling-to-training-aware-nas-5110e13ccfe5
GitLab Basics: A Beginner’s First Look,GitLab 101: An Introduction for Beginners,Data Engineering,Data Engineering,Ci Cd Pipeline,DevOps,Git,Gitlab,https://medium.com/devops-dev/gitlab-basics-a-beginners-first-look-778fbfb1ae97
LangChain in Chains #50: Runnables,Runnables: The Building Blocks of LangChain,Langchain,Langchain,Llm,Llm Applications,Generative Ai Tools,Python,https://medium.com/ai-mind-labs/langchain-in-chains-50-runnables-956656912882
